[
  {
    "eventName": "Queensland Track Series - Series Entry",
    "eventDate": "2026-02-21T00:00:00Z",
    "clubName": "AusCycling (Queensland)",
    "state": "QLD",
    "eventUrl": "https://entryboss.cc/races/5406"
  },
  {
    "eventName": "Beginner Coaching Clinic - Track",
    "eventDate": "2026-02-21T00:00:00Z",
    "clubName": "Cairns Cycling Club",
    "state": "QLD",
    "eventUrl": "https://entryboss.cc/races/29605"
  },
  {
    "eventName": "Sizzling Summer Series - Series Entry",
    "eventDate": "2026-02-21T00:00:00Z",
    "clubName": "AusCycling (Queensland)",
    "state": "QLD",
    "eventUrl": "https://entryboss.cc/races/4762"
  },
  {
    "eventName": "2026 Gold Coast CC | Summer Criterium Series - Round 2",
    "eventDate": "2026-02-21T00:00:00Z",
    "clubName": "AusCycling (Queensland)",
    "state": "QLD",
    "eventUrl": "https://entryboss.cc/races/29002"
  },
  {
    "eventName": "Sizzling Summer Series - Series Entry",
    "eventDate": "2026-02-21T00:00:00Z",
    "clubName": "AusCycling (Queensland)",
    "state": "QLD",
    "eventUrl": "https://entryboss.cc/races/6291"
  },
  {
    "eventName": "Nundah - Time Trial - Sunday 22nd Feb 2026",
    "eventDate": "2026-02-22T00:00:00Z",
    "clubName": "Hamilton Wheelers Cycling Club",
    "state": "QLD",
    "eventUrl": "https://entryboss.cc/races/29456"
  },
  {
    "eventName": "Cairns BMX Open Gates 24-02-2026",
    "eventDate": "2026-02-24T00:00:00Z",
    "clubName": "Cairns BMX Club",
    "state": "QLD",
    "eventUrl": "https://entryboss.cc/races/29637"
  },
  {
    "eventName": "Balmoral CC weekly Wednesday track night (Feb 25)",
    "eventDate": "2026-02-25T00:00:00Z",
    "clubName": "Balmoral Cycling Club",
    "state": "QLD",
    "eventUrl": "https://entryboss.cc/races/29517"
  },
  {
    "eventName": "Wed. Night Gates (6pm - 8pm)",
    "eventDate": "2026-02-25T00:00:00Z",
    "clubName": "Pine Rivers BMX Club",
    "state": "QLD",
    "eventUrl": "https://entryboss.cc/races/28951"
  },
  {
    "eventName": "Club Racing Mackay 19th February 2026",
    "eventDate": "2026-02-26T00:00:00Z",
    "clubName": "Mackay and District BMX Club Inc",
    "state": "QLD",
    "eventUrl": "https://entryboss.cc/races/29294"
  },
  {
    "eventName": "Friday Racing 27.02.26",
    "eventDate": "2026-02-27T00:00:00Z",
    "clubName": "Rockhampton BMX Club",
    "state": "QLD",
    "eventUrl": "https://entryboss.cc/races/29489"
  },
  {
    "eventName": "Pine Rivers 2026 Series 1 Round 3",
    "eventDate": "2026-02-27T00:00:00Z",
    "clubName": "Pine Rivers BMX Club",
    "state": "QLD",
    "eventUrl": "https://entryboss.cc/races/28927"
  },
  {
    "eventName": "Cairns BMX Club Night 27-02-2026 Round 3",
    "eventDate": "2026-02-27T00:00:00Z",
    "clubName": "Cairns BMX Club",
    "state": "QLD",
    "eventUrl": "https://entryboss.cc/races/29638"
  },
  {
    "eventName": "Track Racing",
    "eventDate": "2026-02-27T00:00:00Z",
    "clubName": "Rockhampton Cycling Club",
    "state": "QLD",
    "eventUrl": "https://entryboss.cc/races/29493"
  },
  {
    "eventName": "Anna Meares Velodrome Track Series - Round 6 inc Team Pursuit \u0026 Points Race",
    "eventDate": "2026-02-28T00:00:00Z",
    "clubName": "AusCycling (Queensland)",
    "state": "QLD",
    "eventUrl": "https://entryboss.cc/races/28464"
  },
  {
    "eventName": "Junior Team Training 2026 Term 1",
    "eventDate": "2026-02-28T00:00:00Z",
    "clubName": "Hamilton Wheelers Cycling Club",
    "state": "QLD",
    "eventUrl": "https://entryboss.cc/races/29073"
  },
  {
    "eventName": "Nundah Criterium - Sat 28th Feb 2026",
    "eventDate": "2026-02-28T00:00:00Z",
    "clubName": "Hamilton Wheelers Cycling Club",
    "state": "QLD",
    "eventUrl": "https://entryboss.cc/races/29583"
  },
  {
    "eventName": "Training for Nationals Program",
    "eventDate": "2026-02-28T00:00:00Z",
    "clubName": "Cairns BMX Club",
    "state": "QLD",
    "eventUrl": "https://entryboss.cc/races/29630"
  },
  {
    "eventName": "UQCC Criterium - Nundah - 4:00-6:00pm",
    "eventDate": "2026-02-28T00:00:00Z",
    "clubName": "University of Queensland Cycle Club",
    "state": "QLD",
    "eventUrl": "https://entryboss.cc/races/29042"
  },
  {
    "eventName": "Muzz 2.0 - OG Reverse (Feb 28)",
    "eventDate": "2026-02-28T00:00:00Z",
    "clubName": "Balmoral Cycling Club",
    "state": "QLD",
    "eventUrl": "https://entryboss.cc/races/29518"
  },
  {
    "eventName": "2026 Trek Rocky MTB Club XCEN 3 Hour Day/Night",
    "eventDate": "2026-02-28T00:00:00Z",
    "clubName": "Rockhampton MTB Club",
    "state": "QLD",
    "eventUrl": "https://entryboss.cc/races/29218"
  },
  {
    "eventName": "Ashmore Open Day",
    "eventDate": "2026-02-28T00:00:00Z",
    "clubName": "Ashmore BMX",
    "state": "QLD",
    "eventUrl": "https://entryboss.cc/races/29223"
  },
  {
    "eventName": "2026 Club Racing - Round 2",
    "eventDate": "2026-03-01T00:00:00Z",
    "clubName": "Hinterland BMX Club",
    "state": "QLD",
    "eventUrl": "https://entryboss.cc/races/29649"
  },
  {
    "eventName": "2026 Gold Coast CC | Summer Criterium Series - Round 3",
    "eventDate": "2026-03-01T00:00:00Z",
    "clubName": "AusCycling (Queensland)",
    "state": "QLD",
    "eventUrl": "https://entryboss.cc/races/29004"
  },
  {
    "eventName": "Womens Only - Ride-Connect-Inspire",
    "eventDate": "2026-03-01T00:00:00Z",
    "clubName": "Mackay and District (MAD) Mountain Bike Club",
    "state": "QLD",
    "eventUrl": "https://entryboss.cc/races/28887"
  },
  {
    "eventName": "Sleeman Gates 01Mar2026",
    "eventDate": "2026-03-01T00:00:00Z",
    "clubName": "Bayside BMX Club",
    "state": "QLD",
    "eventUrl": "https://entryboss.cc/races/29077"
  },
  {
    "eventName": "Cairns BMX Open Gates 03-03-2026",
    "eventDate": "2026-03-03T00:00:00Z",
    "clubName": "Cairns BMX Club",
    "state": "QLD",
    "eventUrl": "https://entryboss.cc/races/29639"
  },
  {
    "eventName": "Balmoral CC weekly Wednesday track night (Mar 04)",
    "eventDate": "2026-03-04T00:00:00Z",
    "clubName": "Balmoral Cycling Club",
    "state": "QLD",
    "eventUrl": "https://entryboss.cc/races/29521"
  },
  {
    "eventName": "Wed. Night Gates (6pm - 8pm)",
    "eventDate": "2026-03-04T00:00:00Z",
    "clubName": "Pine Rivers BMX Club",
    "state": "QLD",
    "eventUrl": "https://entryboss.cc/races/28952"
  },
  {
    "eventName": "Brisbane SX Gates - 05/03/2026",
    "eventDate": "2026-03-05T00:00:00Z",
    "clubName": "CTD Industries (QLD)",
    "state": "QLD",
    "eventUrl": "https://entryboss.cc/races/29544"
  },
  {
    "eventName": "Cairns BMX Club Night 06-03-2026 Round 4",
    "eventDate": "2026-03-06T00:00:00Z",
    "clubName": "Cairns BMX Club",
    "state": "QLD",
    "eventUrl": "https://entryboss.cc/races/29640"
  },
  {
    "eventName": "Ipswich Friday Night Crit",
    "eventDate": "2026-03-06T00:00:00Z",
    "clubName": "Ipswich Cycling Club",
    "state": "QLD",
    "eventUrl": "https://entryboss.cc/races/28999"
  },
  {
    "eventName": "Friday Night Racing",
    "eventDate": "2026-03-06T00:00:00Z",
    "clubName": "Toowoomba BMX Club",
    "state": "QLD",
    "eventUrl": "https://entryboss.cc/races/29279"
  },
  {
    "eventName": "Pine Rivers 2026 Series 1 Round 4",
    "eventDate": "2026-03-06T00:00:00Z",
    "clubName": "Pine Rivers BMX Club",
    "state": "QLD",
    "eventUrl": "https://entryboss.cc/races/28928"
  },
  {
    "eventName": "Muzz 2.0 - U Reverse (Mar 07)",
    "eventDate": "2026-03-07T00:00:00Z",
    "clubName": "Balmoral Cycling Club",
    "state": "QLD",
    "eventUrl": "https://entryboss.cc/races/29519"
  },
  {
    "eventName": "Wolf Racing Team/HWCC Nundah Crit - Sat 7th March 2026",
    "eventDate": "2026-03-07T00:00:00Z",
    "clubName": "Hamilton Wheelers Cycling Club",
    "state": "QLD",
    "eventUrl": "https://entryboss.cc/races/29573"
  },
  {
    "eventName": "MAD MTBC - XCO Seeding Race 2",
    "eventDate": "2026-03-07T00:00:00Z",
    "clubName": "Mackay and District (MAD) Mountain Bike Club",
    "state": "QLD",
    "eventUrl": "https://entryboss.cc/races/29609"
  },
  {
    "eventName": "Girraween Crit",
    "eventDate": "2026-03-08T00:00:00Z",
    "clubName": "Sunshine Coast Cycling Club",
    "state": "QLD",
    "eventUrl": "https://entryboss.cc/races/29466"
  },
  {
    "eventName": "Cairns BMX Open Gates 10-03-2026",
    "eventDate": "2026-03-10T00:00:00Z",
    "clubName": "Cairns BMX Club",
    "state": "QLD",
    "eventUrl": "https://entryboss.cc/races/29641"
  },
  {
    "eventName": "Wed. Night Gates (6pm - 8pm)",
    "eventDate": "2026-03-11T00:00:00Z",
    "clubName": "Pine Rivers BMX Club",
    "state": "QLD",
    "eventUrl": "https://entryboss.cc/races/28953"
  },
  {
    "eventName": "Balmoral CC weekly Wednesday track night (Mar 11)",
    "eventDate": "2026-03-11T00:00:00Z",
    "clubName": "Balmoral Cycling Club",
    "state": "QLD",
    "eventUrl": "https://entryboss.cc/races/29522"
  },
  {
    "eventName": "Brisbane SX Gates - 12/03/2026",
    "eventDate": "2026-03-12T00:00:00Z",
    "clubName": "CTD Industries (QLD)",
    "state": "QLD",
    "eventUrl": "https://entryboss.cc/races/29545"
  },
  {
    "eventName": "Cairns BMX Club Night 13-03-2026 Round 5",
    "eventDate": "2026-03-13T00:00:00Z",
    "clubName": "Cairns BMX Club",
    "state": "QLD",
    "eventUrl": "https://entryboss.cc/races/29642"
  },
  {
    "eventName": "Muzz 2.0 - OG Clockwise (Mar 14)",
    "eventDate": "2026-03-14T00:00:00Z",
    "clubName": "Balmoral Cycling Club",
    "state": "QLD",
    "eventUrl": "https://entryboss.cc/races/29520"
  },
  {
    "eventName": "2026 AusCycling BMX State Series - QLD RD1 Central Highlands",
    "eventDate": "2026-03-14T00:00:00Z",
    "clubName": "AusCycling (Queensland)",
    "state": "QLD",
    "eventUrl": "https://entryboss.cc/races/28545"
  },
  {
    "eventName": "Field Engineers XCO Series Race 1",
    "eventDate": "2026-03-14T00:00:00Z",
    "clubName": "Mackay and District (MAD) Mountain Bike Club",
    "state": "QLD",
    "eventUrl": "https://entryboss.cc/races/29225"
  },
  {
    "eventName": "2026 AusCycling BMX State Series - QLD RD2 Central Highlands",
    "eventDate": "2026-03-15T00:00:00Z",
    "clubName": "AusCycling (Queensland)",
    "state": "QLD",
    "eventUrl": "https://entryboss.cc/races/28546"
  },
  {
    "eventName": "Summer Sprints 2026 - Series Entry - All 3 events",
    "eventDate": "2026-03-15T00:00:00Z",
    "clubName": "RATS Cycling Club",
    "state": "QLD",
    "eventUrl": "https://entryboss.cc/races/28479"
  },
  {
    "eventName": "Lifecycle CC - Nundah Criterium by Brisbane Bicycle Service",
    "eventDate": "2026-03-15T00:00:00Z",
    "clubName": "Lifecycle Cycling Club",
    "state": "QLD",
    "eventUrl": "https://entryboss.cc/races/29419"
  },
  {
    "eventName": "Summer Sprints 2026 Round 3 Daisy Hill",
    "eventDate": "2026-03-15T00:00:00Z",
    "clubName": "RATS Cycling Club",
    "state": "QLD",
    "eventUrl": "https://entryboss.cc/races/28602"
  },
  {
    "eventName": "Cairns BMX Open Gates 17-03-2026",
    "eventDate": "2026-03-17T00:00:00Z",
    "clubName": "Cairns BMX Club",
    "state": "QLD",
    "eventUrl": "https://entryboss.cc/races/29643"
  },
  {
    "eventName": "Wed. Night Gates (6pm - 8pm)",
    "eventDate": "2026-03-18T00:00:00Z",
    "clubName": "Pine Rivers BMX Club",
    "state": "QLD",
    "eventUrl": "https://entryboss.cc/races/28954"
  },
  {
    "eventName": "Brisbane SX Gates - 19/03/2026",
    "eventDate": "2026-03-19T00:00:00Z",
    "clubName": "CTD Industries (QLD)",
    "state": "QLD",
    "eventUrl": "https://entryboss.cc/races/29546"
  },
  {
    "eventName": "Friday Night Racing",
    "eventDate": "2026-03-20T00:00:00Z",
    "clubName": "Toowoomba BMX Club",
    "state": "QLD",
    "eventUrl": "https://entryboss.cc/races/29280"
  },
  {
    "eventName": "Cairns BMX Club Night 20-03-2026 Round 6",
    "eventDate": "2026-03-20T00:00:00Z",
    "clubName": "Cairns BMX Club",
    "state": "QLD",
    "eventUrl": "https://entryboss.cc/races/29644"
  },
  {
    "eventName": "Pine River BMX March Madness",
    "eventDate": "2026-03-21T00:00:00Z",
    "clubName": "Pine Rivers BMX Club",
    "state": "QLD",
    "eventUrl": "https://entryboss.cc/races/28962"
  },
  {
    "eventName": "HWCC/McCarthy Homes - Lakeside Reverse - Sat 21st March",
    "eventDate": "2026-03-21T00:00:00Z",
    "clubName": "Hamilton Wheelers Cycling Club",
    "state": "QLD",
    "eventUrl": "https://entryboss.cc/races/29636"
  },
  {
    "eventName": "Girraween Gallop",
    "eventDate": "2026-03-22T00:00:00Z",
    "clubName": "Sunshine Coast Cycling Club",
    "state": "QLD",
    "eventUrl": "https://entryboss.cc/races/29467"
  },
  {
    "eventName": "Cairns BMX Open Gates 24-03-2026",
    "eventDate": "2026-03-24T00:00:00Z",
    "clubName": "Cairns BMX Club",
    "state": "QLD",
    "eventUrl": "https://entryboss.cc/races/29645"
  },
  {
    "eventName": "Wed. Night Gates (6pm - 8pm)",
    "eventDate": "2026-03-25T00:00:00Z",
    "clubName": "Pine Rivers BMX Club",
    "state": "QLD",
    "eventUrl": "https://entryboss.cc/races/28955"
  },
  {
    "eventName": "Brisbane SX Gates - 26/03/2026",
    "eventDate": "2026-03-26T00:00:00Z",
    "clubName": "CTD Industries (QLD)",
    "state": "QLD",
    "eventUrl": "https://entryboss.cc/races/29547"
  },
  {
    "eventName": "Pine Rivers 2026 Series 1 Round 5",
    "eventDate": "2026-03-27T00:00:00Z",
    "clubName": "Pine Rivers BMX Club",
    "state": "QLD",
    "eventUrl": "https://entryboss.cc/races/28929"
  },
  {
    "eventName": "Cairns Bmx Super Clubbie 28-03-2026 Round 7",
    "eventDate": "2026-03-28T00:00:00Z",
    "clubName": "Cairns BMX Club",
    "state": "QLD",
    "eventUrl": "https://entryboss.cc/races/29631"
  },
  {
    "eventName": "Field Engineers XCO Series Race 2",
    "eventDate": "2026-03-28T00:00:00Z",
    "clubName": "Mackay and District (MAD) Mountain Bike Club",
    "state": "QLD",
    "eventUrl": "https://entryboss.cc/races/29226"
  },
  {
    "eventName": "Cairns BMX Open Gates 31-03-2026",
    "eventDate": "2026-03-31T00:00:00Z",
    "clubName": "Cairns BMX Club",
    "state": "QLD",
    "eventUrl": "https://entryboss.cc/races/29646"
  },
  {
    "eventName": "Wed. Night Gates (6pm - 8pm)",
    "eventDate": "2026-04-01T00:00:00Z",
    "clubName": "Pine Rivers BMX Club",
    "state": "QLD",
    "eventUrl": "https://entryboss.cc/races/28956"
  },
  {
    "eventName": "Brisbane SX Gates - 02/04/2026",
    "eventDate": "2026-04-02T00:00:00Z",
    "clubName": "CTD Industries (QLD)",
    "state": "QLD",
    "eventUrl": "https://entryboss.cc/races/29548"
  },
  {
    "eventName": "Wed. Night Gates (6pm - 8pm)",
    "eventDate": "2026-04-08T00:00:00Z",
    "clubName": "Pine Rivers BMX Club",
    "state": "QLD",
    "eventUrl": "https://entryboss.cc/races/28957"
  },
  {
    "eventName": "Brisbane SX Gates - 09/04/2026",
    "eventDate": "2026-04-09T00:00:00Z",
    "clubName": "CTD Industries (QLD)",
    "state": "QLD",
    "eventUrl": "https://entryboss.cc/races/29549"
  },
  {
    "eventName": "Skippy Park Crit",
    "eventDate": "2026-04-12T00:00:00Z",
    "clubName": "Sunshine Coast Cycling Club",
    "state": "QLD",
    "eventUrl": "https://entryboss.cc/races/29468"
  },
  {
    "eventName": "Wed. Night Gates (6pm - 8pm)",
    "eventDate": "2026-04-15T00:00:00Z",
    "clubName": "Pine Rivers BMX Club",
    "state": "QLD",
    "eventUrl": "https://entryboss.cc/races/28958"
  },
  {
    "eventName": "Ipswich Friday Night Crit",
    "eventDate": "2026-04-17T00:00:00Z",
    "clubName": "Ipswich Cycling Club",
    "state": "QLD",
    "eventUrl": "https://entryboss.cc/races/29000"
  },
  {
    "eventName": "Field Engineers XCO Series Race 3",
    "eventDate": "2026-04-18T00:00:00Z",
    "clubName": "Mackay and District (MAD) Mountain Bike Club",
    "state": "QLD",
    "eventUrl": "https://entryboss.cc/races/29228"
  },
  {
    "eventName": "Lifecycle CC - Nundah Criterium by Brisbane Bicycle Service",
    "eventDate": "2026-04-19T00:00:00Z",
    "clubName": "Lifecycle Cycling Club",
    "state": "QLD",
    "eventUrl": "https://entryboss.cc/races/29421"
  },
  {
    "eventName": "2026 Sunshine Women's Tour",
    "eventDate": "2026-04-19T00:00:00Z",
    "clubName": "AusCycling (Queensland)",
    "state": "QLD",
    "eventUrl": "https://entryboss.cc/races/29048"
  },
  {
    "eventName": "Cairns BMX Open Gates 21-04-2026",
    "eventDate": "2026-04-21T00:00:00Z",
    "clubName": "Cairns BMX Club",
    "state": "QLD",
    "eventUrl": "https://entryboss.cc/races/29647"
  },
  {
    "eventName": "Wed. Night Gates (6pm - 8pm)",
    "eventDate": "2026-04-22T00:00:00Z",
    "clubName": "Pine Rivers BMX Club",
    "state": "QLD",
    "eventUrl": "https://entryboss.cc/races/28959"
  },
  {
    "eventName": "Demarken Thursday Thunder Term 2",
    "eventDate": "2026-04-23T00:00:00Z",
    "clubName": "Mackay and District (MAD) Mountain Bike Club",
    "state": "QLD",
    "eventUrl": "https://entryboss.cc/races/29275"
  },
  {
    "eventName": "Pine Rivers 2026 Series 1 Round 6",
    "eventDate": "2026-04-24T00:00:00Z",
    "clubName": "Pine Rivers BMX Club",
    "state": "QLD",
    "eventUrl": "https://entryboss.cc/races/28930"
  },
  {
    "eventName": "Cairns BMX Club Night 24-04-2026 Round 8",
    "eventDate": "2026-04-24T00:00:00Z",
    "clubName": "Cairns BMX Club",
    "state": "QLD",
    "eventUrl": "https://entryboss.cc/races/29648"
  },
  {
    "eventName": "RESCHEDULED April 26th - Wild West Summer XCO Series 2025/2026 - Round 6 Castle Hill",
    "eventDate": "2026-04-26T00:00:00Z",
    "clubName": "Ipswich Offroad Cyclists",
    "state": "QLD",
    "eventUrl": "https://entryboss.cc/races/27387"
  },
  {
    "eventName": "Wed. Night Gates (6pm - 8pm)",
    "eventDate": "2026-04-29T00:00:00Z",
    "clubName": "Pine Rivers BMX Club",
    "state": "QLD",
    "eventUrl": "https://entryboss.cc/races/28960"
  },
  {
    "eventName": "Friday Night Racing",
    "eventDate": "2026-05-01T00:00:00Z",
    "clubName": "Toowoomba BMX Club",
    "state": "QLD",
    "eventUrl": "https://entryboss.cc/races/29281"
  },
  {
    "eventName": "CAIRNS MTB DH 1 2026",
    "eventDate": "2026-05-03T00:00:00Z",
    "clubName": "Cairns Mountain Bike Club",
    "state": "QLD",
    "eventUrl": "https://entryboss.cc/races/29448"
  },
  {
    "eventName": "Wed. Night Gates (6pm - 8pm)",
    "eventDate": "2026-05-06T00:00:00Z",
    "clubName": "Pine Rivers BMX Club",
    "state": "QLD",
    "eventUrl": "https://entryboss.cc/races/28963"
  },
  {
    "eventName": "Pine Rivers 2026 Series 1 Round 7",
    "eventDate": "2026-05-08T00:00:00Z",
    "clubName": "Pine Rivers BMX Club",
    "state": "QLD",
    "eventUrl": "https://entryboss.cc/races/28931"
  },
  {
    "eventName": "Wed. Night Gates (6pm - 8pm)",
    "eventDate": "2026-05-13T00:00:00Z",
    "clubName": "Pine Rivers BMX Club",
    "state": "QLD",
    "eventUrl": "https://entryboss.cc/races/28964"
  },
  {
    "eventName": "Friday Night Racing",
    "eventDate": "2026-05-15T00:00:00Z",
    "clubName": "Toowoomba BMX Club",
    "state": "QLD",
    "eventUrl": "https://entryboss.cc/races/29282"
  },
  {
    "eventName": "MAD MTBC Mini DH - Round 1",
    "eventDate": "2026-05-16T00:00:00Z",
    "clubName": "Mackay and District (MAD) Mountain Bike Club",
    "state": "QLD",
    "eventUrl": "https://entryboss.cc/races/29241"
  },
  {
    "eventName": "Junior Enduro 1 2026",
    "eventDate": "2026-05-16T00:00:00Z",
    "clubName": "Cairns Mountain Bike Club",
    "state": "QLD",
    "eventUrl": "https://entryboss.cc/races/29442"
  },
  {
    "eventName": "CAIRNS MTB GRAVITY ENDURO 1 2026",
    "eventDate": "2026-05-17T00:00:00Z",
    "clubName": "Cairns Mountain Bike Club",
    "state": "QLD",
    "eventUrl": "https://entryboss.cc/races/29445"
  },
  {
    "eventName": "Wed. Night Gates (6pm - 8pm)",
    "eventDate": "2026-05-20T00:00:00Z",
    "clubName": "Pine Rivers BMX Club",
    "state": "QLD",
    "eventUrl": "https://entryboss.cc/races/28965"
  },
  {
    "eventName": "Explore Property Commercial MAD Charge XCO 3 Hour Race Presented by MAD MTBC",
    "eventDate": "2026-05-23T00:00:00Z",
    "clubName": "Mackay and District (MAD) Mountain Bike Club",
    "state": "QLD",
    "eventUrl": "https://entryboss.cc/races/29240"
  },
  {
    "eventName": "Lifecycle CC - Saturday Afternoon Nundah Criterium by Brisbane Bicycle Service",
    "eventDate": "2026-05-23T00:00:00Z",
    "clubName": "Lifecycle Cycling Club",
    "state": "QLD",
    "eventUrl": "https://entryboss.cc/races/29430"
  },
  {
    "eventName": "Wed. Night Gates (6pm - 8pm)",
    "eventDate": "2026-05-27T00:00:00Z",
    "clubName": "Pine Rivers BMX Club",
    "state": "QLD",
    "eventUrl": "https://entryboss.cc/races/28966"
  },
  {
    "eventName": "Friday Night Racing",
    "eventDate": "2026-05-29T00:00:00Z",
    "clubName": "Toowoomba BMX Club",
    "state": "QLD",
    "eventUrl": "https://entryboss.cc/races/29283"
  },
  {
    "eventName": "Pine Rivers 2026 Series 1 Round 8",
    "eventDate": "2026-05-29T00:00:00Z",
    "clubName": "Pine Rivers BMX Club",
    "state": "QLD",
    "eventUrl": "https://entryboss.cc/races/28932"
  },
  {
    "eventName": "Wed. Night Gates (6pm - 8pm)",
    "eventDate": "2026-06-03T00:00:00Z",
    "clubName": "Pine Rivers BMX Club",
    "state": "QLD",
    "eventUrl": "https://entryboss.cc/races/28967"
  },
  {
    "eventName": "Pine Rivers 2026 Series 1 Round 9",
    "eventDate": "2026-06-05T00:00:00Z",
    "clubName": "Pine Rivers BMX Club",
    "state": "QLD",
    "eventUrl": "https://entryboss.cc/races/28933"
  },
  {
    "eventName": "2026 Rockhampton MTB Club 60km XCM",
    "eventDate": "2026-06-06T00:00:00Z",
    "clubName": "Rockhampton MTB Club",
    "state": "QLD",
    "eventUrl": "https://entryboss.cc/races/29584"
  },
  {
    "eventName": "Lifecycle CC - Nundah Criterium by Brisbane Bicycle Service",
    "eventDate": "2026-06-07T00:00:00Z",
    "clubName": "Lifecycle Cycling Club",
    "state": "QLD",
    "eventUrl": "https://entryboss.cc/races/29422"
  },
  {
    "eventName": "Wed. Night Gates (6pm - 8pm)",
    "eventDate": "2026-06-10T00:00:00Z",
    "clubName": "Pine Rivers BMX Club",
    "state": "QLD",
    "eventUrl": "https://entryboss.cc/races/28968"
  },
  {
    "eventName": "Frontline Equipment Maintenance 6 Hour MAD Rush",
    "eventDate": "2026-06-13T00:00:00Z",
    "clubName": "Mackay and District (MAD) Mountain Bike Club",
    "state": "QLD",
    "eventUrl": "https://entryboss.cc/races/29244"
  },
  {
    "eventName": "2026 AusCycling BMX State Series - QLD RD3 Cairns",
    "eventDate": "2026-06-13T00:00:00Z",
    "clubName": "AusCycling (Queensland)",
    "state": "QLD",
    "eventUrl": "https://entryboss.cc/races/28547"
  },
  {
    "eventName": "2026 AusCycling BMX State Series - QLD RD4 Cairns",
    "eventDate": "2026-06-14T00:00:00Z",
    "clubName": "AusCycling (Queensland)",
    "state": "QLD",
    "eventUrl": "https://entryboss.cc/races/28548"
  },
  {
    "eventName": "POKER SOCIAL",
    "eventDate": "2026-06-14T00:00:00Z",
    "clubName": "Cairns Mountain Bike Club",
    "state": "QLD",
    "eventUrl": "https://entryboss.cc/races/29450"
  },
  {
    "eventName": "Wed. Night Gates (6pm - 8pm)",
    "eventDate": "2026-06-17T00:00:00Z",
    "clubName": "Pine Rivers BMX Club",
    "state": "QLD",
    "eventUrl": "https://entryboss.cc/races/28969"
  },
  {
    "eventName": "Wed. Night Gates (6pm - 8pm)",
    "eventDate": "2026-06-24T00:00:00Z",
    "clubName": "Pine Rivers BMX Club",
    "state": "QLD",
    "eventUrl": "https://entryboss.cc/races/28970"
  },
  {
    "eventName": "Pine Rivers 2026 Series 1 Round 10",
    "eventDate": "2026-06-26T00:00:00Z",
    "clubName": "Pine Rivers BMX Club",
    "state": "QLD",
    "eventUrl": "https://entryboss.cc/races/28934"
  },
  {
    "eventName": "Wed. Night Gates (6pm - 8pm)",
    "eventDate": "2026-07-01T00:00:00Z",
    "clubName": "Pine Rivers BMX Club",
    "state": "QLD",
    "eventUrl": "https://entryboss.cc/races/28971"
  },
  {
    "eventName": "Wed. Night Gates (6pm - 8pm)",
    "eventDate": "2026-07-08T00:00:00Z",
    "clubName": "Pine Rivers BMX Club",
    "state": "QLD",
    "eventUrl": "https://entryboss.cc/races/28972"
  },
  {
    "eventName": "Junior Enduro 2 2026",
    "eventDate": "2026-07-11T00:00:00Z",
    "clubName": "Cairns Mountain Bike Club",
    "state": "QLD",
    "eventUrl": "https://entryboss.cc/races/29443"
  },
  {
    "eventName": "CAIRNS MTB GRAVITY ENDURO 2 2026",
    "eventDate": "2026-07-12T00:00:00Z",
    "clubName": "Cairns Mountain Bike Club",
    "state": "QLD",
    "eventUrl": "https://entryboss.cc/races/29446"
  },
  {
    "eventName": "Lifecycle CC - Nundah Criterium by Brisbane Bicycle Service",
    "eventDate": "2026-07-12T00:00:00Z",
    "clubName": "Lifecycle Cycling Club",
    "state": "QLD",
    "eventUrl": "https://entryboss.cc/races/29423"
  },
  {
    "eventName": "Wed. Night Gates (6pm - 8pm)",
    "eventDate": "2026-07-15T00:00:00Z",
    "clubName": "Pine Rivers BMX Club",
    "state": "QLD",
    "eventUrl": "https://entryboss.cc/races/28973"
  },
  {
    "eventName": "CAIRNS MTB DH 2 2026",
    "eventDate": "2026-07-19T00:00:00Z",
    "clubName": "Cairns Mountain Bike Club",
    "state": "QLD",
    "eventUrl": "https://entryboss.cc/races/29449"
  },
  {
    "eventName": "Wed. Night Gates (6pm - 8pm)",
    "eventDate": "2026-07-22T00:00:00Z",
    "clubName": "Pine Rivers BMX Club",
    "state": "QLD",
    "eventUrl": "https://entryboss.cc/races/28974"
  },
  {
    "eventName": "MAD MTBC Mini DH - Round 2",
    "eventDate": "2026-07-25T00:00:00Z",
    "clubName": "Mackay and District (MAD) Mountain Bike Club",
    "state": "QLD",
    "eventUrl": "https://entryboss.cc/races/29242"
  },
  {
    "eventName": "Wed. Night Gates (6pm - 8pm)",
    "eventDate": "2026-07-29T00:00:00Z",
    "clubName": "Pine Rivers BMX Club",
    "state": "QLD",
    "eventUrl": "https://entryboss.cc/races/28975"
  },
  {
    "eventName": "Corry Cycles Interschool Gravity Flow Enduro Presented by MAD MTBC",
    "eventDate": "2026-07-31T00:00:00Z",
    "clubName": "Mackay and District (MAD) Mountain Bike Club",
    "state": "QLD",
    "eventUrl": "https://entryboss.cc/races/28067"
  },
  {
    "eventName": "Pine Rivers 2026 Series 2 Round 1",
    "eventDate": "2026-07-31T00:00:00Z",
    "clubName": "Pine Rivers BMX Club",
    "state": "QLD",
    "eventUrl": "https://entryboss.cc/races/28936"
  },
  {
    "eventName": "MAD MTBC Gravity Extravaganza Weekend (Sat + Sun)",
    "eventDate": "2026-08-02T00:00:00Z",
    "clubName": "Mackay and District (MAD) Mountain Bike Club",
    "state": "QLD",
    "eventUrl": "https://entryboss.cc/races/28068"
  },
  {
    "eventName": "Wed. Night Gates (6pm - 8pm)",
    "eventDate": "2026-08-05T00:00:00Z",
    "clubName": "Pine Rivers BMX Club",
    "state": "QLD",
    "eventUrl": "https://entryboss.cc/races/28976"
  },
  {
    "eventName": "2026 AusCycling BMX State Series - QLD RD5 Pine Rivers",
    "eventDate": "2026-08-08T00:00:00Z",
    "clubName": "AusCycling (Queensland)",
    "state": "QLD",
    "eventUrl": "https://entryboss.cc/races/28549"
  },
  {
    "eventName": "2026 AusCycling BMX State Series - QLD RD6 Pine Rivers",
    "eventDate": "2026-08-09T00:00:00Z",
    "clubName": "AusCycling (Queensland)",
    "state": "QLD",
    "eventUrl": "https://entryboss.cc/races/28550"
  },
  {
    "eventName": "Wed. Night Gates (6pm - 8pm)",
    "eventDate": "2026-08-12T00:00:00Z",
    "clubName": "Pine Rivers BMX Club",
    "state": "QLD",
    "eventUrl": "https://entryboss.cc/races/28977"
  },
  {
    "eventName": "Pine Rivers 2026 Series 2 Round 2",
    "eventDate": "2026-08-14T00:00:00Z",
    "clubName": "Pine Rivers BMX Club",
    "state": "QLD",
    "eventUrl": "https://entryboss.cc/races/28937"
  },
  {
    "eventName": "Wed. Night Gates (6pm - 8pm)",
    "eventDate": "2026-08-19T00:00:00Z",
    "clubName": "Pine Rivers BMX Club",
    "state": "QLD",
    "eventUrl": "https://entryboss.cc/races/28978"
  },
  {
    "eventName": "Mackay Cycles XCO Series Race 1",
    "eventDate": "2026-08-22T00:00:00Z",
    "clubName": "Mackay and District (MAD) Mountain Bike Club",
    "state": "QLD",
    "eventUrl": "https://entryboss.cc/races/29234"
  },
  {
    "eventName": "Wed. Night Gates (6pm - 8pm)",
    "eventDate": "2026-08-26T00:00:00Z",
    "clubName": "Pine Rivers BMX Club",
    "state": "QLD",
    "eventUrl": "https://entryboss.cc/races/28979"
  },
  {
    "eventName": "Pine Rivers 2026 Series 2 Round 3",
    "eventDate": "2026-08-28T00:00:00Z",
    "clubName": "Pine Rivers BMX Club",
    "state": "QLD",
    "eventUrl": "https://entryboss.cc/races/28938"
  },
  {
    "eventName": "Mackay Cycles XCO Series Race 2",
    "eventDate": "2026-08-29T00:00:00Z",
    "clubName": "Mackay and District (MAD) Mountain Bike Club",
    "state": "QLD",
    "eventUrl": "https://entryboss.cc/races/29235"
  },
  {
    "eventName": "Wed. Night Gates (6pm - 8pm)",
    "eventDate": "2026-09-02T00:00:00Z",
    "clubName": "Pine Rivers BMX Club",
    "state": "QLD",
    "eventUrl": "https://entryboss.cc/races/28980"
  },
  {
    "eventName": "Pine Rivers 2026 Series 2 Round 4",
    "eventDate": "2026-09-11T00:00:00Z",
    "clubName": "Pine Rivers BMX Club",
    "state": "QLD",
    "eventUrl": "https://entryboss.cc/races/28939"
  },
  {
    "eventName": "Mackay Cycles XCO Series Race 3",
    "eventDate": "2026-09-12T00:00:00Z",
    "clubName": "Mackay and District (MAD) Mountain Bike Club",
    "state": "QLD",
    "eventUrl": "https://entryboss.cc/races/29236"
  },
  {
    "eventName": "Wed. Night Gates (6pm - 8pm)",
    "eventDate": "2026-09-16T00:00:00Z",
    "clubName": "Pine Rivers BMX Club",
    "state": "QLD",
    "eventUrl": "https://entryboss.cc/races/28981"
  },
  {
    "eventName": "MAD MTBC Mini DH - Round 3",
    "eventDate": "2026-09-19T00:00:00Z",
    "clubName": "Mackay and District (MAD) Mountain Bike Club",
    "state": "QLD",
    "eventUrl": "https://entryboss.cc/races/29243"
  },
  {
    "eventName": "Junior Enduro 3 2026",
    "eventDate": "2026-09-19T00:00:00Z",
    "clubName": "Cairns Mountain Bike Club",
    "state": "QLD",
    "eventUrl": "https://entryboss.cc/races/29444"
  },
  {
    "eventName": "CAIRNS MTB GRAVITY ENDURO 3 2026",
    "eventDate": "2026-09-20T00:00:00Z",
    "clubName": "Cairns Mountain Bike Club",
    "state": "QLD",
    "eventUrl": "https://entryboss.cc/races/29447"
  },
  {
    "eventName": "Wed. Night Gates (6pm - 8pm)",
    "eventDate": "2026-09-23T00:00:00Z",
    "clubName": "Pine Rivers BMX Club",
    "state": "QLD",
    "eventUrl": "https://entryboss.cc/races/28982"
  },
  {
    "eventName": "Lifecycle CC - Nundah Criterium by Brisbane Bicycle Service",
    "eventDate": "2026-09-27T00:00:00Z",
    "clubName": "Lifecycle Cycling Club",
    "state": "QLD",
    "eventUrl": "https://entryboss.cc/races/29425"
  },
  {
    "eventName": "Wed. Night Gates (6pm - 8pm)",
    "eventDate": "2026-09-30T00:00:00Z",
    "clubName": "Pine Rivers BMX Club",
    "state": "QLD",
    "eventUrl": "https://entryboss.cc/races/28983"
  },
  {
    "eventName": "Wed. Night Gates (6pm - 8pm)",
    "eventDate": "2026-10-07T00:00:00Z",
    "clubName": "Pine Rivers BMX Club",
    "state": "QLD",
    "eventUrl": "https://entryboss.cc/races/28984"
  },
  {
    "eventName": "Pine Rivers 2026 Series 2 Round 5",
    "eventDate": "2026-10-09T00:00:00Z",
    "clubName": "Pine Rivers BMX Club",
    "state": "QLD",
    "eventUrl": "https://entryboss.cc/races/28940"
  },
  {
    "eventName": "Corry Cycles Boogieman Series Race 1 (Day/Night)",
    "eventDate": "2026-10-10T00:00:00Z",
    "clubName": "Mackay and District (MAD) Mountain Bike Club",
    "state": "QLD",
    "eventUrl": "https://entryboss.cc/races/29237"
  },
  {
    "eventName": "Wed. Night Gates (6pm - 8pm)",
    "eventDate": "2026-10-14T00:00:00Z",
    "clubName": "Pine Rivers BMX Club",
    "state": "QLD",
    "eventUrl": "https://entryboss.cc/races/28985"
  },
  {
    "eventName": "Atherton October Overdrive Carnival",
    "eventDate": "2026-10-17T00:00:00Z",
    "clubName": "Atherton BMX Club",
    "state": "QLD",
    "eventUrl": "https://entryboss.cc/races/28804"
  },
  {
    "eventName": "PONY EXPRESS DAY/NIGHT 2026",
    "eventDate": "2026-10-17T00:00:00Z",
    "clubName": "Cairns Mountain Bike Club",
    "state": "QLD",
    "eventUrl": "https://entryboss.cc/races/29451"
  },
  {
    "eventName": "Wed. Night Gates (6pm - 8pm)",
    "eventDate": "2026-10-21T00:00:00Z",
    "clubName": "Pine Rivers BMX Club",
    "state": "QLD",
    "eventUrl": "https://entryboss.cc/races/28986"
  },
  {
    "eventName": "Pine Rivers 2026 Series 2 Round 6",
    "eventDate": "2026-10-23T00:00:00Z",
    "clubName": "Pine Rivers BMX Club",
    "state": "QLD",
    "eventUrl": "https://entryboss.cc/races/28941"
  },
  {
    "eventName": "Corry Cycles Boogieman Series Race 2 (Day/Night)",
    "eventDate": "2026-10-24T00:00:00Z",
    "clubName": "Mackay and District (MAD) Mountain Bike Club",
    "state": "QLD",
    "eventUrl": "https://entryboss.cc/races/29238"
  },
  {
    "eventName": "Lifecycle CC - Nundah Criterium by Brisbane Bicycle Service",
    "eventDate": "2026-10-25T00:00:00Z",
    "clubName": "Lifecycle Cycling Club",
    "state": "QLD",
    "eventUrl": "https://entryboss.cc/races/29426"
  },
  {
    "eventName": "Wed. Night Gates (6pm - 8pm)",
    "eventDate": "2026-10-28T00:00:00Z",
    "clubName": "Pine Rivers BMX Club",
    "state": "QLD",
    "eventUrl": "https://entryboss.cc/races/28987"
  },
  {
    "eventName": "Pine Rivers 2026 Series 2 Round 7",
    "eventDate": "2026-10-30T00:00:00Z",
    "clubName": "Pine Rivers BMX Club",
    "state": "QLD",
    "eventUrl": "https://entryboss.cc/races/28942"
  },
  {
    "eventName": "Wed. Night Gates (6pm - 8pm)",
    "eventDate": "2026-11-04T00:00:00Z",
    "clubName": "Pine Rivers BMX Club",
    "state": "QLD",
    "eventUrl": "https://entryboss.cc/races/28988"
  },
  {
    "eventName": "Corry Cycles Boogieman Series Race 3 (Day/Night)",
    "eventDate": "2026-11-07T00:00:00Z",
    "clubName": "Mackay and District (MAD) Mountain Bike Club",
    "state": "QLD",
    "eventUrl": "https://entryboss.cc/races/29239"
  },
  {
    "eventName": "Wed. Night Gates (6pm - 8pm)",
    "eventDate": "2026-11-11T00:00:00Z",
    "clubName": "Pine Rivers BMX Club",
    "state": "QLD",
    "eventUrl": "https://entryboss.cc/races/28989"
  },
  {
    "eventName": "Pine Rivers 2026 Series 2 Round 8",
    "eventDate": "2026-11-13T00:00:00Z",
    "clubName": "Pine Rivers BMX Club",
    "state": "QLD",
    "eventUrl": "https://entryboss.cc/races/28943"
  },
  {
    "eventName": "Wed. Night Gates (6pm - 8pm)",
    "eventDate": "2026-11-18T00:00:00Z",
    "clubName": "Pine Rivers BMX Club",
    "state": "QLD",
    "eventUrl": "https://entryboss.cc/races/28990"
  },
  {
    "eventName": "Wed. Night Gates (6pm - 8pm)",
    "eventDate": "2026-11-25T00:00:00Z",
    "clubName": "Pine Rivers BMX Club",
    "state": "QLD",
    "eventUrl": "https://entryboss.cc/races/28991"
  },
  {
    "eventName": "Pine Rivers 2026 Series 2 Round 9",
    "eventDate": "2026-11-27T00:00:00Z",
    "clubName": "Pine Rivers BMX Club",
    "state": "QLD",
    "eventUrl": "https://entryboss.cc/races/28944"
  },
  {
    "eventName": "MAD MTBC Pony Express Event",
    "eventDate": "2026-12-05T00:00:00Z",
    "clubName": "Mackay and District (MAD) Mountain Bike Club",
    "state": "QLD",
    "eventUrl": "https://entryboss.cc/races/29245"
  },
  {
    "eventName": "Lifecycle CC - Nundah Criterium by Brisbane Bicycle Service",
    "eventDate": "2026-12-06T00:00:00Z",
    "clubName": "Lifecycle Cycling Club",
    "state": "QLD",
    "eventUrl": "https://entryboss.cc/races/29428"
  }
]